{"$schema": "../../schemas/SCHEMA-000014-agent.json", "id": "AIOS-AGENT-000003", "name": "Backend Agent", "role": "backend", "version": "1.0.0", "description": "Backend API and service implementation. Consume language packs for conventions.", "domain": "backend", "frameworks": ["express", "fastapi", "spring"], "languages": ["typescript", "python", "java", "rust"], "required_capabilities": ["code_generation", "unit_testing"], "thinking_budget": "medium"}