{"$schema":"../../schemas/SCHEMA-000014-agent.json","id":"AIOS-AGENT-000005","name":"Database Agent","role":"database","version":"1.0.0","description":"Database schema design, migration planning, query optimization, and data modeling specialist.","domain":"data","frameworks":["prisma","sequelize","django-orm","sqlalchemy"],"languages":["sql","python","typescript"],"required_capabilities":["code_generation","unit_testing"],"thinking_budget":"high"}