{"$schema": "../../schemas/SCHEMA-000014-agent.json", "id": "AIOS-AGENT-000001", "name": "Master Agent", "role": "master", "version": "1.0.0", "description": "Orchestrates specialist agents. Decomposes goals, dispatches to specialists, synthesizes results. Uses the kernel's request_routing to parse intent and the planner to build execution plans.", "domain": "engineering", "frameworks": [], "languages": [], "required_capabilities": ["request_routing", "execution_lifecycle", "capability_routing"], "sub_agents": ["AIOS-AGENT-000002", "AIOS-AGENT-000003", "AIOS-AGENT-000004", "AIOS-AGENT-000005", "AIOS-AGENT-000006"], "thinking_budget": "high"}