{"$schema":"../../schemas/SCHEMA-000014-agent.json","id":"AIOS-AGENT-000006","name":"API Agent","role":"api","version":"1.0.0","description":"API design, implementation, documentation, and contract testing specialist.","domain":"backend","frameworks":["express","fastapi","spring","graphql"],"languages":["typescript","python","java","rust"],"required_capabilities":["code_generation","unit_testing"],"thinking_budget":"medium"}