{"$schema":"../../schemas/SCHEMA-000014-agent.json","id":"AIOS-AGENT-000010","name":"Documentation Agent","role":"documentation","version":"1.0.0","description":"Documentation generation, API reference writing, changelog maintenance, and README creation specialist.","domain":"documentation","frameworks":[],"languages":[],"required_capabilities":["documentation_generation"],"thinking_budget":"low"}