{"$schema": "../../schemas/SCHEMA-000014-agent.json", "id": "AIOS-AGENT-000004", "name": "Frontend Agent", "role": "frontend", "version": "1.0.0", "description": "Frontend component creation with framework conventions.", "domain": "frontend", "frameworks": ["react", "vue", "svelte", "nextjs"], "languages": ["typescript", "javascript"], "required_capabilities": ["code_generation"], "thinking_budget": "medium"}