{"$schema":"../../schemas/SCHEMA-000014-agent.json","id":"AIOS-AGENT-000014","name":"Laravel Agent","role":"backend","version":"1.0.0","description":"Laravel development specialist. Eloquent, Blade, Livewire, Sail, Jetstream, and Laravel conventions.","domain":"backend","frameworks":["laravel","livewire","filament","tall-stack"],"languages":["php","javascript"],"required_capabilities":["code_generation"],"thinking_budget":"medium"}