{"$schema":"../../schemas/SCHEMA-000014-agent.json","id":"AIOS-AGENT-000016","name":"Reviewer Agent","role":"reviewer","version":"1.0.0","description":"Senior engineer code review specialist. Architecture, security, performance, style, and correctness review.","domain":"engineering","frameworks":[],"languages":[],"required_capabilities":["code_review","architecture_analysis"],"sub_agents":["AIOS-AGENT-000002"],"thinking_budget":"high"}