{"$schema":"../../schemas/SCHEMA-000014-agent.json","id":"AIOS-AGENT-000009","name":"Security Agent","role":"security","version":"1.0.0","description":"Security audit, vulnerability assessment, threat modeling, and secure coding guidance specialist.","domain":"security","frameworks":[],"languages":["python","rust","typescript"],"required_capabilities":["vulnerability_scanning","compliance_checking"],"thinking_budget":"high"}