{"$schema":"../../schemas/SCHEMA-000014-agent.json","id":"AIOS-AGENT-000013","name":"Flutter Agent","role":"flutter","version":"1.0.0","description":"Flutter cross-platform development specialist. Dart, Widget tree, state management, platform channels.","domain":"mobile","frameworks":["flutter","riverpod","bloc","getx"],"languages":["dart"],"required_capabilities":["code_generation"],"thinking_budget":"medium"}