{"$schema":"../../schemas/SCHEMA-000014-agent.json","id":"AIOS-AGENT-000011","name":"Android Agent","role":"backend","version":"1.0.0","description":"Android native development specialist. Kotlin, Jetpack Compose, Room, ExoPlayer, Material Design conventions.","domain":"mobile","frameworks":["jetpack-compose","room","exoplayer","hilt"],"languages":["kotlin","java"],"required_capabilities":["code_generation","unit_testing"],"thinking_budget":"medium"}