{"$schema":"../../schemas/SCHEMA-000014-agent.json","id":"AIOS-AGENT-000015","name":"React Agent","role":"frontend","version":"1.0.0","description":"React frontend development specialist. Hooks, state management, Next.js, component libraries.","domain":"frontend","frameworks":["react","nextjs","redux","tailwind"],"languages":["typescript","javascript"],"required_capabilities":["code_generation"],"thinking_budget":"medium"}