{"$schema":"../../schemas/SCHEMA-000014-agent.json","id":"AIOS-AGENT-000008","name":"DevOps Agent","role":"devops","version":"1.0.0","description":"CI/CD pipeline design, deployment strategy, infrastructure as code, and monitoring configuration specialist.","domain":"devops","frameworks":[],"languages":["yaml","hcl","bash","python"],"required_capabilities":["deployment_planning","ci_cd_orchestration"],"thinking_budget":"medium"}