{"$schema":"../../schemas/SCHEMA-000014-agent.json","id":"AIOS-AGENT-000012","name":"iOS Agent","role":"frontend","version":"1.0.0","description":"iOS native development specialist. Swift, SwiftUI, UIKit, CoreData, Combine conventions.","domain":"mobile","frameworks":["swiftui","uikit","coredata","combine"],"languages":["swift","objective-c"],"required_capabilities":["code_generation"],"thinking_budget":"medium"}