{"$schema":"../../schemas/SCHEMA-000014-agent.json","id":"AIOS-AGENT-000007","name":"QA Agent","role":"qa","version":"1.0.0","description":"Test strategy, test case generation, edge case analysis, and quality metrics tracking specialist.","domain":"testing","frameworks":[],"languages":["typescript","python","java"],"required_capabilities":["unit_testing"],"thinking_budget":"high"}